Number,Scramble,Single,Best Single,Best Single No,Ao5,Best Ao5,Best Ao5 No,Ao12,Best Ao12,Best Ao12 No,Ao50,Best Ao50,Best Ao50 No,Ao100,Best Ao100,Best Ao100 No,Ao1000,Best Ao1000,Best Ao1000 No
1,U F2 D2 L D2 B' U D' L2 D' R U2 L2 U F2 U' F2 R2 D,0.797,0.797,1,0,0,0,0,0,0,0,0,0,0,0,0,0,0,0
2,R' U2 B2 D2 U2 R2 B2 U2 B F' U L' U' L2 D F' U R,1.117,0.797,1,0,0,0,0,0,0,0,0,0,0,0,0,0,0,0
3,F' L' D' B L' U D R' F' U' L' F' L2 F' U2 F2 U2 B2,0.941,0.797,1,0,0,0,0,0,0,0,0,0,0,0,0,0,0,0
4,B' R L2 D' L' D2 L F D2 R' L2 F B2 L2 F' R2 B' L2 B2 R2,1.039,0.797,1,0,0,0,0,0,0,0,0,0,0,0,0,0,0,0
5,L2 F' L2 F2 L2 F' R2 F2 U2 L' D2 F2 U' L2 R2 B' U2 R' F' U',0.952,0.797,1,0.977,0.977,5,0,0,0,0,0,0,0,0,0,0,0,0
